query_id,query_text
2001150,how often should a 60 year old lift weights
471153,how to disable security software temporarily
4146142,what makes florida special
3546964,how to upcycle old clothing
3541044,how to fix waney edge cladding
2009255,how to reference a picture from a book
1996814,how did the simulated experience of linda waterfall’s case make you feel?
8742902,what color is your birth
1080004,when was myocarditis discovered
6610960,how to help gorillas
473198,how to hacking wifi network
472651,how to get gta 5 for free on pc on windows 10
1086996,why does my toilet run every 5 minutes
3539620,how to cure pork ham
3543616,how to make website easily
8141918,how to bleed ac system car
471762,how to export a database in sql server
8747370,what is natural light photography
3531989,how big was the crowd on jan 6th
8742783,what causes the tip of my tongue to burn
6610303,how to get free shipping from amazon
3540281,how to draw a girl easy
7209951,what does blackpill mean
4147074,what to put in bridal shower favor bags
463970,how do i say youre my love and hero elowuent!y
2604220,what drugs make you hallucinate
6611149,how to insert a solid line in word
5081342,how to super compress a pdf
4146986,what to do with oil after deep frying
2603066,what do i do when i drop my phone in water
3538716,how to check if marriage is registered
5080329,how to restrict remote desktop user access
1996723,how did jill biden meet joe biden
1086715,why do people believe conspiracy theories
5684385,when was joel osteen divorced
1087901,why therapy doesn't work for some people
5677297,what is a transfer airport for usps
5082359,how to view only fans for free
4142989,what is deca steroid
476377,how to restart application into unhandledexception by vb.net
7212781,what is data privacy and why is it important
8150573,how to tell someone to be more confident
2005236,how to find roblox codes
5683739,when does pansear learn ember
1076655,what kind of substance is being represented by the structure below?
8744804,what happens on st patrick's day
4897381,does biotin help your hair grow
5678016,what is delta h
8755036,which eboy are you quiz
2619899,why filioque should not divide christians
